{
  "suite_version": "0.1.0",
  "benchmark_version": "0.2.0-draft",
  "scenario_pack_version": "coverage-fresh-pack-0.3.0",
  "split": "fresh",
  "scenarios": [
    {
      "scenario_id": "hidden_0to1_activation_loop_fresh_001",
      "path": "hidden_0to1_activation_loop_fresh_scenario.json",
      "track": "0to1",
      "mode": "fresh"
    },
    {
      "scenario_id": "hidden_0to1_false_demand_fresh_001",
      "path": "hidden_0to1_false_demand_fresh_scenario.json",
      "track": "0to1",
      "mode": "fresh"
    },
    {
      "scenario_id": "hidden_finance_bridge_terms_fresh_001",
      "path": "hidden_finance_bridge_terms_fresh_scenario.json",
      "track": "finance",
      "mode": "fresh"
    },
    {
      "scenario_id": "hidden_finance_collection_drag_fresh_001",
      "path": "hidden_finance_collection_drag_fresh_scenario.json",
      "track": "finance",
      "mode": "fresh"
    },
    {
      "scenario_id": "hidden_people_ownership_break_fresh_001",
      "path": "hidden_people_ownership_break_fresh_scenario.json",
      "track": "people",
      "mode": "fresh"
    },
    {
      "scenario_id": "hidden_launch_distribution_fresh_001",
      "path": "hidden_launch_distribution_fresh_scenario.json",
      "track": "gtm",
      "mode": "fresh"
    }
  ]
}
