{
  "suite_version": "0.1.0",
  "benchmark_version": "0.2.0-draft",
  "scenario_pack_version": "canary-test-pack-0.1.0",
  "split": "test",
  "scenarios": [
    {
      "scenario_id": "hidden_canary_pricing_trap_test_001",
      "path": "hidden_canary_pricing_trap_test_scenario.json",
      "track": "gtm",
      "mode": "test"
    },
    {
      "scenario_id": "hidden_canary_hiring_trap_test_001",
      "path": "hidden_canary_hiring_trap_test_scenario.json",
      "track": "people",
      "mode": "test"
    }
  ]
}
