{
  "suite_version": "0.1.0",
  "benchmark_version": "0.2.0-draft",
  "scenario_pack_version": "operator-test-pack-0.4.0",
  "split": "test",
  "scenarios": [
    {
      "scenario_id": "hidden_gtm_pipeline_reset_test_001",
      "path": "hidden_gtm_pipeline_reset_test_scenario.json",
      "track": "gtm",
      "mode": "test"
    },
    {
      "scenario_id": "hidden_gtm_enterprise_freeze_test_001",
      "path": "hidden_gtm_enterprise_freeze_test_scenario.json",
      "track": "gtm",
      "mode": "test"
    },
    {
      "scenario_id": "hidden_gtm_reference_decay_test_001",
      "path": "hidden_gtm_reference_decay_test_scenario.json",
      "track": "gtm",
      "mode": "test"
    },
    {
      "scenario_id": "hidden_finance_liquidity_test_001",
      "path": "hidden_finance_liquidity_test_scenario.json",
      "track": "finance",
      "mode": "test"
    },
    {
      "scenario_id": "hidden_finance_margin_shock_test_001",
      "path": "hidden_finance_margin_shock_test_scenario.json",
      "track": "finance",
      "mode": "test"
    },
    {
      "scenario_id": "hidden_finance_covenant_squeeze_test_001",
      "path": "hidden_finance_covenant_squeeze_test_scenario.json",
      "track": "finance",
      "mode": "test"
    },
    {
      "scenario_id": "hidden_people_attrition_test_001",
      "path": "hidden_people_attrition_test_scenario.json",
      "track": "people",
      "mode": "test"
    },
    {
      "scenario_id": "hidden_people_reorg_drag_test_001",
      "path": "hidden_people_reorg_drag_test_scenario.json",
      "track": "people",
      "mode": "test"
    },
    {
      "scenario_id": "hidden_people_manager_span_test_001",
      "path": "hidden_people_manager_span_test_scenario.json",
      "track": "people",
      "mode": "test"
    }
  ]
}
