{
  "suite_version": "0.1.0",
  "benchmark_version": "0.2.0-draft",
  "scenario_pack_version": "real-world-test-pack-0.3.0",
  "split": "test",
  "scenarios": [
    {
      "scenario_id": "real_world_airbnb_emergency_financing_test_001",
      "path": "real_world_airbnb_emergency_financing_test_scenario.json",
      "track": "board",
      "mode": "test"
    },
    {
      "scenario_id": "real_world_brex_svb_treasury_shock_test_001",
      "path": "real_world_brex_svb_treasury_shock_test_scenario.json",
      "track": "crisis",
      "mode": "test"
    },
    {
      "scenario_id": "real_world_buffer_runway_crunch_test_001",
      "path": "real_world_buffer_runway_crunch_test_scenario.json",
      "track": "finance",
      "mode": "test"
    },
    {
      "scenario_id": "real_world_dropbox_phishing_test_001",
      "path": "real_world_dropbox_phishing_test_scenario.json",
      "track": "crisis",
      "mode": "test"
    },
    {
      "scenario_id": "real_world_github_failover_test_001",
      "path": "real_world_github_failover_test_scenario.json",
      "track": "crisis",
      "mode": "test"
    },
    {
      "scenario_id": "real_world_zoom_security_freeze_test_001",
      "path": "real_world_zoom_security_freeze_test_scenario.json",
      "track": "crisis",
      "mode": "test"
    },
    {
      "scenario_id": "real_world_atlassian_restoration_test_001",
      "path": "real_world_atlassian_restoration_test_scenario.json",
      "track": "crisis",
      "mode": "test"
    },
    {
      "scenario_id": "real_world_shopify_peak_readiness_test_001",
      "path": "real_world_shopify_peak_readiness_test_scenario.json",
      "track": "scale",
      "mode": "test"
    }
  ]
}
