{
  "suite_version": "0.1.0",
  "benchmark_version": "0.2.0-draft",
  "scenario_pack_version": "canary-fresh-pack-0.4.0",
  "split": "fresh",
  "scenarios": [
    {
      "scenario_id": "hidden_canary_pricing_trap_fresh_001",
      "path": "hidden_canary_pricing_trap_fresh_scenario.json",
      "track": "gtm",
      "mode": "fresh"
    },
    {
      "scenario_id": "hidden_canary_hiring_trap_fresh_001",
      "path": "hidden_canary_hiring_trap_fresh_scenario.json",
      "track": "people",
      "mode": "fresh"
    },
    {
      "scenario_id": "hidden_canary_treasury_shuffle_fresh_001",
      "path": "hidden_canary_treasury_shuffle_fresh_scenario.json",
      "track": "finance",
      "mode": "fresh"
    },
    {
      "scenario_id": "hidden_canary_renewal_nudge_fresh_001",
      "path": "hidden_canary_renewal_nudge_fresh_scenario.json",
      "track": "gtm",
      "mode": "fresh"
    },
    {
      "scenario_id": "hidden_canary_launch_surge_fresh_001",
      "path": "hidden_canary_launch_surge_fresh_scenario.json",
      "track": "gtm",
      "mode": "fresh"
    },
    {
      "scenario_id": "hidden_canary_experiment_vanity_fresh_001",
      "path": "hidden_canary_experiment_vanity_fresh_scenario.json",
      "track": "gtm",
      "mode": "fresh"
    },
    {
      "scenario_id": "hidden_canary_bridge_panic_fresh_001",
      "path": "hidden_canary_bridge_panic_fresh_scenario.json",
      "track": "finance",
      "mode": "fresh"
    },
    {
      "scenario_id": "hidden_canary_org_reset_fresh_001",
      "path": "hidden_canary_org_reset_fresh_scenario.json",
      "track": "people",
      "mode": "fresh"
    }
  ]
}
