{
  "suite_version": "0.1.0",
  "benchmark_version": "0.2.0-draft",
  "scenario_pack_version": "operator-fresh-pack-0.5.0",
  "split": "fresh",
  "scenarios": [
    {
      "scenario_id": "hidden_gtm_pipeline_reset_fresh_001",
      "path": "hidden_gtm_pipeline_reset_fresh_scenario.json",
      "track": "gtm",
      "mode": "fresh"
    },
    {
      "scenario_id": "hidden_gtm_enterprise_freeze_fresh_001",
      "path": "hidden_gtm_enterprise_freeze_fresh_scenario.json",
      "track": "gtm",
      "mode": "fresh"
    },
    {
      "scenario_id": "hidden_gtm_reference_decay_fresh_001",
      "path": "hidden_gtm_reference_decay_fresh_scenario.json",
      "track": "gtm",
      "mode": "fresh"
    },
    {
      "scenario_id": "hidden_finance_liquidity_fresh_001",
      "path": "hidden_finance_liquidity_fresh_scenario.json",
      "track": "finance",
      "mode": "fresh"
    },
    {
      "scenario_id": "hidden_finance_margin_shock_fresh_001",
      "path": "hidden_finance_margin_shock_fresh_scenario.json",
      "track": "finance",
      "mode": "fresh"
    },
    {
      "scenario_id": "hidden_finance_covenant_squeeze_fresh_001",
      "path": "hidden_finance_covenant_squeeze_fresh_scenario.json",
      "track": "finance",
      "mode": "fresh"
    },
    {
      "scenario_id": "hidden_people_attrition_fresh_001",
      "path": "hidden_people_attrition_fresh_scenario.json",
      "track": "people",
      "mode": "fresh"
    },
    {
      "scenario_id": "hidden_people_reorg_drag_fresh_001",
      "path": "hidden_people_reorg_drag_fresh_scenario.json",
      "track": "people",
      "mode": "fresh"
    },
    {
      "scenario_id": "hidden_people_manager_span_fresh_001",
      "path": "hidden_people_manager_span_fresh_scenario.json",
      "track": "people",
      "mode": "fresh"
    },
    {
      "scenario_id": "hidden_gtm_discount_spiral_fresh_001",
      "path": "hidden_gtm_discount_spiral_fresh_scenario.json",
      "track": "gtm",
      "mode": "fresh"
    },
    {
      "scenario_id": "hidden_gtm_partner_backfire_fresh_001",
      "path": "hidden_gtm_partner_backfire_fresh_scenario.json",
      "track": "gtm",
      "mode": "fresh"
    },
    {
      "scenario_id": "hidden_finance_receivables_freeze_fresh_001",
      "path": "hidden_finance_receivables_freeze_fresh_scenario.json",
      "track": "finance",
      "mode": "fresh"
    },
    {
      "scenario_id": "hidden_finance_stepdown_raise_fresh_001",
      "path": "hidden_finance_stepdown_raise_fresh_scenario.json",
      "track": "finance",
      "mode": "fresh"
    },
    {
      "scenario_id": "hidden_people_exec_backfill_fresh_001",
      "path": "hidden_people_exec_backfill_fresh_scenario.json",
      "track": "people",
      "mode": "fresh"
    },
    {
      "scenario_id": "hidden_people_support_burnout_fresh_001",
      "path": "hidden_people_support_burnout_fresh_scenario.json",
      "track": "people",
      "mode": "fresh"
    },
    {
      "scenario_id": "hidden_people_decision_latency_fresh_001",
      "path": "hidden_people_decision_latency_fresh_scenario.json",
      "track": "people",
      "mode": "fresh"
    }
  ]
}
