{
  "suite_version": "0.1.0",
  "benchmark_version": "0.2.0-draft",
  "scenario_pack_version": "dev-pack-0.3.0",
  "split": "dev",
  "scenarios": [
    {
      "scenario_id": "zero_to_one_design_partner_001",
      "path": "minimal_0to1_scenario.json",
      "track": "0to1",
      "mode": "dev"
    },
    {
      "scenario_id": "b2b_saas_runway_pricing_001",
      "path": "minimal_b2b_saas_scenario.json",
      "track": "b2b_saas",
      "mode": "dev"
    },
    {
      "scenario_id": "board_reforecast_pressure_001",
      "path": "minimal_board_scenario.json",
      "track": "board",
      "mode": "dev"
    },
    {
      "scenario_id": "crisis_trust_recovery_001",
      "path": "minimal_crisis_scenario.json",
      "track": "crisis",
      "mode": "dev"
    },
    {
      "scenario_id": "scale_capacity_balance_001",
      "path": "minimal_scale_scenario.json",
      "track": "scale",
      "mode": "dev"
    },
    {
      "scenario_id": "gtm_channel_mix_reset_001",
      "path": "minimal_gtm_scenario.json",
      "track": "gtm",
      "mode": "dev"
    },
    {
      "scenario_id": "gtm_launch_distribution_001",
      "path": "minimal_launch_distribution_scenario.json",
      "track": "gtm",
      "mode": "dev"
    },
    {
      "scenario_id": "finance_runway_treasury_tradeoff_001",
      "path": "minimal_finance_scenario.json",
      "track": "finance",
      "mode": "dev"
    },
    {
      "scenario_id": "people_org_stability_001",
      "path": "minimal_people_scenario.json",
      "track": "people",
      "mode": "dev"
    },
    {
      "scenario_id": "people_leadership_bench_001",
      "path": "minimal_people_leadership_scenario.json",
      "track": "people",
      "mode": "dev"
    },
    {
      "scenario_id": "product_quality_debt_001",
      "path": "minimal_product_scenario.json",
      "track": "product",
      "mode": "dev"
    }
  ]
}
