{
  "suite_version": "0.1.0",
  "benchmark_version": "0.2.0-draft",
  "scenario_pack_version": "human-review-wave-001-real-world",
  "split": "test",
  "scenarios": [
    {
      "scenario_id": "real_world_zoom_security_freeze_test_001",
      "path": "real_world_zoom_security_freeze_test_scenario.json",
      "track": "crisis",
      "mode": "test"
    },
    {
      "scenario_id": "real_world_brex_svb_treasury_shock_test_001",
      "path": "real_world_brex_svb_treasury_shock_test_scenario.json",
      "track": "crisis",
      "mode": "test"
    }
  ]
}
